title,article,alinea,revisto,validado,law_description,topico,referencia,referencia_incm
 APOSENTAÇÃO VOLUNTÁRIA, 39,4, , Andreia Chrystêllo,"4. O pedido de aposentação pode ser apresentado com a antecedência máxima de três meses em relação à data em que o 
interessado reúna todos os requisitos para a aposentação.","['Aposentação Voluntária', ' Antecedência']",[' '],
 APOSENTAÇÃO VOLUNTÁRIA, 39,5, , Andreia Chrystêllo,"5. O requerente pode indicar, no pedido de aposentação, uma data posterior a considerar pela CGA para os efeitos do n.º 1 do 
artigo 43.º, sendo tal indicação obrigatória nos pedidos apresentados nos termos do número anterior.","['Pedido', ' Aposentação Voluntária']","['43.1 (from)', ' 39.4']",
 APOSENTAÇÃO VOLUNTÁRIA, 39,6, , Andreia Chrystêllo,"6. O requerente não pode desistir do pedido de aposentação depois de proferido despacho a reconhecer o direito a aposentação 
voluntária que não dependa de incapacidade, ou de verificados os factos a que se refere o n.º 2 do artigo 43.º","['Aposentação Voluntária', ' Pedido']",['43.2 (from)'],
 APOSENTAÇÃO DE ANTIGO SUBSCRITOR, 40,1, , Andreia Chrystêllo,"1. A eliminação da qualidade de subscritor não extingue o direito de requerer a aposentação nos seguintes casos: a) Previstos nos 
n.os 1 e 2 e nas alíneas a) e b) do n.º 3 do artigo 37.º, quando a cessação definitiva de funções ocorra após cinco anos de serviço; b) 
Previstos nos artigos 37.º-A e 37.º-B, quando a cessação definitiva de funções ocorra após cinco anos de subscritor e, 
cumulativamente, este não reúna as condições de acesso a pensão atribuída por outro regime de proteção social de inscrição 
obrigatória.","['Demissão, Direito de Aposentação']","[' 37.1 (from)', ' 37.2 (from)', ' 37.3 (from)', ' 37A (from)', ' 37B (from)']",
 APOSENTAÇÃO DE ANTIGO SUBSCRITOR, 40,2, , Andreia Chrystêllo,"2. Quando a eliminação da qualidade de subscritor tiver resultado de demissão, mesmo com expresso fundamento em infração 
penal ou disciplinar, a aposentação só poderá ser concedida, a requerimento do interessado, dois anos após a aplicação da pena 
desde que ele conte, pelo menos, 5 anos de serviço e observada uma das seguintes condições: a) Seja declarado, em exame 
médico, absoluta e permanentemente incapaz; b) Tenha atingido o limite de idade.","['Demissão, Direito de Aposentação, Incapacidade, Limite de Idade']",[' '],
 APOSENTAÇÃO DE ANTIGO SUBSCRITOR, 40,3, , Andreia Chrystêllo,"3. Se, porém, a eliminação for consequência de infração penal pela qual o ex-subscritor seja condenado a pena superior a dois 
anos, a concessão da pensão de aposentação apenas poderá ter lugar findo o cumprimento da pena, se contar 5 anos de serviço e
nos termos das alíneas a) ou b) do número anterior.","['Direito de Aposentação, Infração , Penas']",[' 40.2 (from)'],
 APOSENTAÇÃO OBRIGATÓRIA POR INCAPACIDADE OU POR , 41,1, , Andreia Chrystêllo,"1. Nos casos da alínea a) do n.º 3 do artigo 37.º, a aposentação ordinária pode também ser promovida pelo competente órgão 
superior da Administração Pública, mediante apresentação do subscritor a exame médico.","['Aposentação obrigatória, Incapacidade', ' Exame Médico, Situação Clínica']",['37.3(from) '],LIMITE DE IDADE
 APOSENTAÇÃO OBRIGATÓRIA POR INCAPACIDADE OU POR , 41,2, , Andreia Chrystêllo,"2. A aposentação por limite de idade, a que se refere a alínea b) do n.º 3 do artigo 37.º, é promovida pelo serviço a que o subscritor 
estiver adstrito.",['Limite de idade'],['37.3(from)'],LIMITE DE IDADE
 APOSENTAÇÃO COMPULSIVA, 42,1, , Andreia Chrystêllo,"1. A aposentação compulsiva é aplicada por decisão da autoridade competente, pelas infrações disciplinares previstas na lei, ou por 
deliberação do Conselho de Ministros, nos casos permitidos em lei especial.","['Aposentação Compulsiva, Infração ']",[''],
 APOSENTAÇÃO COMPULSIVA, 42,2, , Andreia Chrystêllo,"2. A aplicação desta pena só terá lugar quando a Caixa informe que o subscritor reúne o pressuposto do tempo de serviço exigível, 
nos termos do artigo 37.º, para a aposentação ordinária.","['Aposentação Compulsiva, Penas']",['37 (from)'],
 REGIME DA APOSENTAÇÃO, 43,1, , Andreia Chrystêllo,"1. O regime da aposentação voluntária que não dependa de verificação de incapacidade fixa-se com base na lei em vigor à data em 
que seja recebido o pedido de aposentação pela CGA, sem prejuízo do disposto no n.º 7 do artigo 39.º, e na situação existente à 
data em que o mesmo seja despachado.","['Aposentação Voluntária, Incapacidade.']","['39.7 (from); Acórdão do Tribunal Constitucional n.º 134/2019', ' publicado no Diário da República', ' 1.ª série', ' de 3 de abril de 2019 (declara a \ninconstitucionalidade', ' com força obrigatória geral', ' da norma do segmento do artigo 43.º', ' n.º 1', ' do Estatuto da Aposentação', ' na redação dada pela Lei n.º 66-\nB/2012', ' de 31 de dezembro', ' que determina que a aposentação voluntária se rege pela lei em vigor no momento em que for proferido o despacho a \nreconhecer o direito à aposentação); artigo 282.º', ' «Efeitos da declaração de inconstitucionalidade ou de ilegalidade»', ' da Constituição da República.']"," ACÓRDÃO DO TRIBUNAL CONSTITUCIONAL N.º 134/2019, PUBLICADO 
NO DIÁRIO DA REPÚBLICA, 1.ª SÉRIE, DE 3 DE ABRIL DE 2019."
 REGIME DA APOSENTAÇÃO, 43,2, , Andreia Chrystêllo,"2. Nas restantes situações, o regime da aposentação fixa-se com base na lei em vigor e na situação existente à data em que: a) Seja
declarada a incapacidade pela competente junta médica ou homologado o parecer desta, quando a lei especial o exija; b) O 
interessado atinja o limite de idade; c) Se profira decisão que imponha pena expulsiva ou se prefira condenação penal definitiva da 
qual resulta a demissão ou que coloque o interessado em situação equivalente.","['Carreira Longa, Reforma Antecipada, Aposentação Compulsiva', ' Incapacidade', ' Situação Clínica']",[''],
 REGIME DA APOSENTAÇÃO, 43,3, , Andreia Chrystêllo,"3. O disposto no n.º 1 não prejudica os efeitos que a lei atribua, em matéria de aposentação, a situações anteriores.",[' Regime'],['43.1(from)'],
 REGIME DA APOSENTAÇÃO, 43,4, , Andreia Chrystêllo,4. É irrelevante qualquer alteração de remunerações ocorrida posteriormente à data a que se refere o n.º 2 do artigo 33.º,"['Regime', ' Remuneração', ' Relevância']",['33.2(from)'],
 CARGO PELO QUAL SE VERIFICA A APOSENTAÇÃO, 44,1, , Andreia Chrystêllo,1. O subscritor é aposentado pelo último cargo em que esteja inscrito na Caixa.,['Direito de Aposentação'],[' '],
 CARGO PELO QUAL SE VERIFICA A APOSENTAÇÃO, 44,2, , Andreia Chrystêllo,"2. Se à função exercida pelo subscritor, fora do quadro ou da categoria a que pertença, não corresponder direito de aposentação,
esta efetivar-se-á pelo cargo de origem.",['Direito de Aposentação'],[' '],
 CONCORRÊNCIA DE CARGOS, 45,1, , Andreia Chrystêllo,"1. O subscritor com direito de aposentação por mais de um cargo deverá escolher aquele por que pretende ser aposentado, salvo
nos casos em que lei especial faculte a aposentação cumulativa pelos cargos simultaneamente exercidos.","['Direito de Aposentação, Acumulação de Cargos']",[' '],
 CONCORRÊNCIA DE CARGOS, 45,2, , Andreia Chrystêllo,"2. O subscritor que tenha também direito de aposentação por cargo que exerça em regime de comissão ou requisição poderá optar
pela aposentação correspondente ao seu cargo de origem.","['Direito de Aposentação', ' Regime']",[''],
 DIREITO À PENSÃO, 46,1, , Andreia Chrystêllo,"Pela aposentação o interessado adquire o direito a uma pensão mensal vitalícia, fixada pela Caixa, nos termos dos artigos seguintes, 
em função da remuneração mensal e do número de anos e meses de serviço de subscritor, bem como, se for caso disso, do seu 
grau de incapacidade.",['Direito à Pensão'],[' ']," DECRETO-LEI N.º 361/98, DE 18 DE NOVEMBRO"
 REMUNERAÇÃO MENSAL, 47,1, , Andreia Chrystêllo,"1. Para determinar a remuneração mensal atende-se às seguintes parcelas, que respeitem ao cargo pelo qual o subscritor é 
aposentado: a) O ordenado ou outra retribuição base de carácter mensal, ou a duodécima parte da que for estabelecida por ano ou 
corresponder ao número de dias de serviço anual, quando fixada por dia ou por hora; b) A média mensal das demais remunerações
percebidas pelo subscritor nos dois últimos anos e que devam ser consideradas nos termos do artigo seguinte.","['Cálculo de Pensão, Remuneração']",[' 48'],
 REMUNERAÇÃO MENSAL, 47,2, , Andreia Chrystêllo,"2. Quando o período de serviço legalmente estabelecido seja inferior ao ano, o montante global das respetivas remunerações, que 
hajam de converter-se em mensais para os efeitos do presente artigo, será dividido pelo número de meses que naquele período se 
comporte.",['Remuneração'],[' '],
 REMUNERAÇÃO MENSAL, 47,3, , Andreia Chrystêllo,"3. Será havida como enumeração dos cargos exercidos em regime de tempo parcial, depois de efetuada a conversão prevista no n.º 
2 do artigo 26.º, a que corresponder ao serviço em regime de tempo completo.","['Remuneração, Tempo Parcial']",['26.2 (from)'],
 REMUNERAÇÃO MENSAL, 47,4, , Andreia Chrystêllo,"4. As remunerações percebidas a título de participações emolumentares, qualquer que seja a sua natureza, são em todos os casos 
consideradas para a aposentação, nos termos do disposto da alínea b) do n.º 1.","['Remuneração, Emolumentos.']","[' 6.1', ' 47.1 (from); Parecer do Conselho Consultivo da Procuradoria-Geral da República n.º 28/2017', ' publicado no Diário da República', ' 2.ª série', ' \nde 1 de outubro de 2019 (natureza jurídica da participação emolumentar atribuída aos oficiais dos registos e do notariado).']"," PARECER DO CONSELHO CONSULTIVO DA PROCURADORIA-GERAL DA REPÚBLICA N.º 28/2017, PUBLICADO 
NO DIÁRIO DA REPÚBLICA, 2.ª SÉRIE, DE 1 DE OUTUBRO DE 2019"
 REMUNERAÇÃO MENSAL, 47,5, , Andreia Chrystêllo,"5. Nos casos em que a média das remunerações previstas na alínea b) do n.º 1, adicionada da remuneração estabelecida na alínea 
a) do mesmo número, exceda a remuneração base legalmente fixada para o cargo de Primeiro-Ministro, será a remuneração 
mensal relevante reduzida até ao limite daquela.",['Remuneração'],['47.1 (from)'],
 REMUNERAÇÕES A CONSIDERAR, 48,1, , Andreia Chrystêllo,"As remunerações a considerar para os efeitos do artigo anterior serão as abrangidas pelo n.º 1 do artigo 6.º, com exceção das que 
não tiverem carácter permanente, das gratificações que não forem de atribuição obrigatória, das remunerações complementares 
por serviço prestado no ultramar e das resultantes da acumulação de outros cargos.","['Remuneração, Ultramarina, Acumulação de Cargos']","[' 6.1 (from)', ' 47']",
 SUBSCRITORES EM SERVIÇO MILITAR, 49,1, , Andreia Chrystêllo,"No caso de aposentação por incapacidade motivada pela prestação de serviço militar, a pensão, observado o disposto nos artigos 
anteriores, tem por base as remunerações correspondentes a esse serviço, se forem superiores às do cargo pelo qual o subscritor é 
aposentado.","['Serviço Militar, Remuneração']","[' 46', ' 47', ' 48']",
 SUCESSÃO DE CARGOS, 50,1, , Andreia Chrystêllo,"1. Se durante os dois últimos anos o subscritor houver exercido sucessivamente dois ou mais cargos a que a lei em vigor à data dos 
factos previstos no n.º 2 do artigo 33.º atribua remunerações diferentes, atender-se-á à média destas, na proporção do tempo de 
serviço em cada cargo.","['Acumulação de Cargos, Tempo de Serviço']",[' 33.2 (from)'],
 SUCESSÃO DE CARGOS, 50,2, , Andreia Chrystêllo,"2. Quando, porém, a sucessão de cargos corresponda a acesso, previsto na lei, a lugar superior da mesma hierarquia ou do mesmo 
serviço, atender-se-á somente à remuneração relativa ao último desses cargos, qualquer que seja o tempo de permanência nele.",['Sucessão de Cargos'],['50.1'],
 REGIMES ESPECIAIS, 51,1, , Andreia Chrystêllo,"1. A remuneração mensal relevante para o cálculo da pensão do subscritor que nos últimos três anos tenha exercido cargos 
dirigentes em regime de comissão de serviço determina-se pela média das remunerações correspondentes a cada um dos cargos 
exercidos e na proporção do tempo de serviço neles prestado.","['Remuneração, Cálculo de Pensão, Tempo de Serviço']","['Acórdão do Tribunal Constitucional n.º 360/2003', ' publicado no Diário daRepública', ' 1.ª série', ' de 7 de outubro de 2003 (declara a \ninconstitucionalidade', ' com força obrigatória geral', ' das normas constantes dos n.os 1 a 8 do artigo 9.º da Lei n.º 32-B/2002', ' de 30 de dezembro', ' por \nviolação do direito das associaçõessindicais à participação na elaboração da legislação do trabalho', ' previsto na alínea a) do n.º 2 do artigo \n56.º da Constituição).']"," ACÓRDÃO DO TRIBUNAL CONSTITUCIONAL N.º 360/2003, PUBLICADO NO DIÁRIO DA REPÚBLICA, 1.ª SÉRIE, 
DE 7 DE OUTUBRO DE 2003"
 REGIMES ESPECIAIS, 51,2, , Andreia Chrystêllo,"2. As remunerações percebidas nos últimos três anos de atividade pela prestação de serviço em diferentes regimes de trabalho, 
que correspondam a aumento sobre a remuneração devida em regime de tempo completo ou integral, relevam para o cálculo da 
pensão na proporção do tempo de serviço prestado em cada regime, durante o referido período.","[' Remuneração, Cálculo de Pensão']",[' '],
 REGIMES ESPECIAIS, 51,3, , Andreia Chrystêllo,"3. Sem prejuízo de outros limites aplicáveis, a pensão de aposentação do subscritor sujeito ao regime do contrato individual de 
trabalho determina-se pela média mensal das remunerações sujeitas a desconto auferidas nos últimos três anos, com exclusão dos 
subsídios de férias e de Natal ou prestações equivalentes.","['Remuneração, Cálculo de Pensão']","['Acórdão do Tribunal Constitucional n.º 302/2006', ' publicado no Diário da República', ' 2.ª série', ' de 12 de junho de 2006 (decide não declarar a \ninconstitucionalidade da norma do n.º 3 do artigo 51.º do Estatuto da Aposentação', ' na redação emergente da Lei n.º 1/2004', ' de 15 de janeiro).']"," ACÓRDÃO DO TRIBUNAL CONSTITUCIONAL N.º 302/2006, PUBLICADO NO DIÁRIO DA REPÚBLICA, 2.ª SÉRIE, DE 
12 DE JUNHO DE 2006"
 REGIMES ESPECIAIS, 51,4, , Andreia Chrystêllo,"4. A remuneração relevante para o cálculo da pensão do pessoal dos gabinetes dos órgãos de soberania, livremente nomeados e 
exonerados pelos respectivos titulares, é a que corresponda ao seu lugar de origem.","['Remuneração, Cálculo de Pensão']",[''],
 SUBSCRITORES EM SERVIÇO NOS ORGANISMOS DE , 52,1, , Andreia Chrystêllo,"1. Independentemente do preceituado no artigo anterior, o subscritor que, em regime de comissão ou de requisição, tenha 
prestado continuadamente serviço nos dois últimos anos em organismos de coordenação económica poderá optar, para o cômputo 
da pensão nos termos dos artigos 47.º a 50.º, pelas remunerações auferidas nessas funções.",['Organismos Extintos'],"[' 47', ' 48', ' 49', ' 50']",COORDENAÇÃO ECONÓMICA E NA ADMINISTRAÇÃO ULTRAMARINA
 SUBSCRITORES EM SERVIÇO NOS ORGANISMOS DE , 52,2, , Andreia Chrystêllo,"2. O regime estabelecido no número anterior é igualmente aplicável ao caso previsto no artigo 12.º, sem prejuízo do disposto no 
artigo 48.º quanto às remunerações complementares por serviço prestado no ultramar.",['Ultramarina'],"[' 12 (from)', ' 48', ' 51.1 (from)']",COORDENAÇÃO ECONÓMICA E NA ADMINISTRAÇÃO ULTRAMARINA
 CÁLCULO DA PENSÃO, 53,1, , Andreia Chrystêllo,"1. A pensão de aposentação é igual à 36.ª parte da remuneração mensal relevante, deduzida da percentagem da quota para efeitos 
de aposentação e de pensão de sobrevivência, multiplicada pela expressão em anos do número de meses de serviço contados para 
a aposentação, com o limite máximo de 36 anos.",['Cálculo de Pensão'],"['Acórdão do Tribunal Constitucional n.º 360/2003', ' publicado no Diário da República', ' 1.ª série', ' de 7 de outubro de 2003 (declara a \ninconstitucionalidade', ' com força obrigatória geral', ' das normas constantes dos n.os 1 a 8 do artigo 9.º da Lei n.º 32-B/2002', ' de 30 de dezembro', ' por violação \ndo direito das associações sindicais à participação na elaboração da legislação do trabalho', ' previsto na alínea a) do n.º 2 do artigo 56.ºda Constituição).']"," ACÓRDÃO DO TRIBUNAL CONSTITUCIONAL N.º 360/2003, PUBLICADO NO DIÁRIO DA REPÚBLICA, 1.ª 
SÉRIE, DE 7 DE OUTUBRO DE 2003"
 CÁLCULO DA PENSÃO, 53,2, , Andreia Chrystêllo,"2. A pensão não pode, em caso algum, exceder o montante da remuneração líquida a que se refere o n.º 1.",['Valor máximo da pensão'],[' 53.1(from)'],
 CÁLCULO DA PENSÃO, 53,3, , Andreia Chrystêllo,"3. Concorrendo tempo de serviço nas condições previstas no artigo 15.º, a pensão será a soma das seguintes parcelas, calculadas 
separadamente: a) Uma, pela Caixa Geral de Aposentações, em função do tempo de serviço por ela contado e a que não 
corresponda dispensa de pagamento de quotas; b) Outra, pela respetiva instituição de previdência social, nos termos dos diplomas 
aplicáveis.",['Cálculo de Pensão'],['15 (from)'],
 CÁLCULO DA PENSÃO, 53,4, , Andreia Chrystêllo,4. O tempo a que se refere o n.º 5 do artigo 37.º não influi na pensão a calcular pela Caixa.,['Cálculo de pensão'],['37.5(from)'],
 REDUÇÃO DA PENSÃO, 56,1, , Andreia Chrystêllo,"No caso de aposentação compulsiva, a pensão é calculada nos termos gerais e reduzida em 4,5% do seu valor por cada ano de 
antecipação em relação à idade legalmente exigida para a aposentação, com o limite de 25%.","['Cálculo de Pensão, Aposentação Compulsiva']",['  42'],
 DEDUÇÕES NA PENSÃO, 57,1, , Andreia Chrystêllo,"1. Serão descontadas na pensão as importâncias em dívida referidas no artigo 18.º, bem como as indemnizações que, por motivo 
da elevação geral de vencimentos, a lei estabeleça.","['Cálculo de Pensão, Dívida']",['18 (from)'],
 DEDUÇÕES NA PENSÃO, 57,2, , Andreia Chrystêllo,"2. O quantitativo da pensão e dos descontos de qualquer natureza que nela hajam de fazer-se serão sempre arredondados para o 
número exato de escudos, por defeito, se a fração for inferior a $50, e por excesso, se igual ou superior.",['Cálculo de Pensão'],[' '],
 DEDUÇÕES NA PENSÃO, 57,3, , Andreia Chrystêllo,3. As pensões atribuídas pela Caixa Geral de Aposentações estão isentas de imposto do selo.,['Cálculo de Pensão'],[' '],
 ALTERAÇÃO DA PENSÃO, 58,1, , Ana Aido,"1. A alteração de resoluções definitivas sobre o quantitativo da pensão, nos casos em que a lei a permita, só produzirá efeitos a 
partir do dia 1 do mês imediato àquele em que for deliberada.","['Alteração da Pensão', ' Cálculo de pensão']",[''],
 ALTERAÇÃO DA PENSÃO, 58,2, , Ana Aido,"2. Os efeitos da alteração reportar-se-ão, todavia, à data em que a resolução anterior os produziu, nos casos seguintes: a) Se a
alteração derivar de recursos contencioso ou hierárquico, de retificação da pensão ou de resolução revogatória da Caixa; b) Se, no 
caso de revisão previsto na alínea a) do n.º 1 do artigo 101.º, a nova resolução for proferida oficiosamente no prazo de sessenta 
dias, a contar da data da resolução revista ou tiver sido requerida pelo interessado nos prazos referidos no n.º 2 do mesmo artigo; 
c) Se a alteração resultar de parecer da junta médica de revisão.",[' Alteração da Pensão'],"[' 101.1', ' 101.2']",
 ATUALIZAÇÃO DE PENSÕES, 59,1, , Ana Aido,"A atualização das pensões será efetuada, em consequência da elevação geral dos vencimentos do funcionalismo ou da criação de 
suplemento ou subsídio geral sobre os mesmos, mediante diploma do Conselho de Ministros, sob proposta do Ministro das 
Finanças e do membro do Governo que tiver a seu cargo a função pública.","[' Alteração da Pensão', ' Atualização de Pensão']",['']," PORTARIA N.º 224/73, DE 30 DE MARÇO"
 ATRIBUIÇÃO DOS ENCARGOS DA APOSENTAÇÃO, 63,1, , Ana Aido,"1. As autarquias locais e outras entidades responsáveis pela aposentação do seu pessoal suportarão, nos termos e dentro dos 
limites da legislação respetiva, e proporcionalmente ao tempo em relação ao qual essa responsabilidade exista, os encargos com as 
pensões de aposentação abonadas pela Caixa.","['Encargo da Aposentação', ' Autarquias Locais']",[''], DL 240-B/2004 DL 240-C/2004 DL N.º 240-D/2004
 ATRIBUIÇÃO DOS ENCARGOS DA APOSENTAÇÃO, 63,2, , Ana Aido,"2. Passam a ser inteiramente responsáveis pelos encargos com a aposentação do seu pessoal subscritor da Caixa, em relação a todo
o tempo de serviço que lhes tenha sido prestado, os seguintes serviços e entidades: a) Os que a lei qualifique de empresas públicas; 
b) As províncias ultramarinas; c) As Câmaras Municipais de Lisboa e do Porto e os respetivos Serviços Municipalizados; d) A Santa 
Casa da Misericórdia de Lisboa; e) Os demais serviços ou entidades, dotados de receitas próprias e que reúnam condições para 
suportar o encargo, a indicar em resolução do Conselho de Ministros, sob proposta do Ministro das Finanças.","['Encargo da Aposentação, Ultramarina, Tempo de serviço, Autarquias Locais']",[''], DL 240-B/2004 DL 240-C/2004 DL N.º 240-D/2004
 ATRIBUIÇÃO DOS ENCARGOS DA APOSENTAÇÃO, 63,3, , Ana Aido,"3. A responsabilidade dos serviços e entidades mencionados nos números anteriores compreende o encargo pela aposentação do 
pessoal que neles se encontre em regime previsto nos artigos 11.º, 12.º e 14.º","['Encargo da Aposentação, Ultramarina, Tempo de serviço, Autarquias Locais']","[' 63.1(from)', ' 63.2(from)', ' 11', ' 12', ' 14']", DL 240-B/2004 DL 240-C/2004 DL N.º 240-D/2004
 ATRIBUIÇÃO DOS ENCARGOS DA APOSENTAÇÃO, 63,4, , Ana Aido,"4. O encargo, com a parte da pensão a que se refere a alínea b) do n.º 3 do artigo 53.º, é suportado pela respetiva instituição de 
previdência.",['Encargo da Aposentação'],[' 53.3'], DL 240-B/2004 DL 240-C/2004 DL N.º 240-D/2004
 ATRIBUIÇÃO DOS ENCARGOS DA APOSENTAÇÃO, 63,6, , Ana Aido,"6. A responsabilidade prevista neste artigo não prejudica a obrigação de pagamento pelo subscritor de quotas e indemnizações 
devidas nos termos do presente Estatuto.","['Quota, Indemnizações']",[' 63'], DL 240-B/2004 DL 240-C/2004 DL N.º 240-D/2004
 ATRIBUIÇÃO DOS ENCARGOS DA APOSENTAÇÃO, 63,7, , Ana Aido,"7. Os encargos com as pensões de aposentação pelo ultramar do pessoal que tenha sido subscritor da Caixa são suportados por 
esta e pelos serviços e entidades referidos nos n.os 1, 2 e 4, em função do tempo de serviço respetivo, competindo à Caixa, quando 
tiver arrecadado as quotas correspondentes, a transferência para os serviços ultramarinos das importâncias destinadas a satisfazer 
esses encargos.","['Ultramarina, Encargo da Aposentação, Quotas, Tempo de serviço.']","[' 63.1', ' 63.2', ' 63.4']", DL 240-B/2004 DL 240-C/2004 DL N.º 240-D/2004
" ENCARGOS COM PENSÕES DA CGA, I. P.", 63A,1, , Ana Aido,"Os montantes correspondentes aos encargos com as pensões e demais prestações abonadas pela CGA, I. P., da responsabilidade de
terceiras entidades, incluindo os encargos referidos no número anterior e os encargos do regime de pensão unificada, devem ser-
lhe entregues até ao dia 15 do mês em que tem lugar o pagamento das pensões e das prestações a que respeitam.","['Encargos da Aposentação, Pensão Unificada']",['63.7'],
 PAGAMENTO DA PENSÃO, 64,1, , Ana Aido,1. A pensão de aposentação é devida pela Caixa a partir da data em que o subscritor passa à situação de aposentado.,['Pagamento da Pensão'],[' ']," DECRETO-LEI N.º 127/87, DE 17 DE MARÇO "
 PAGAMENTO DA PENSÃO, 64,2, , Ana Aido,"2. Com exceção dos casos previstos no n.º 7, a pensão vence-se mensalmente por inteiro no dia 1 do mês a que respeita.",['Pagamento da Pensão'],[' 64.7']," DECRETO-LEI N.º 127/87, DE 17 DE MARÇO "
 PAGAMENTO DA PENSÃO, 64,3, , Ana Aido,"3. Se o aposentado estiver impossibilitado, de modo permanente ou duradouro, de receber a pensão, ou estiver internado em 
estabelecimento de assistência ou equiparado, poderá o conselho de administração da Caixa, não havendo interdição ou 
inabilitação judicial, autorizar que as pensões sejam pagas à pessoa que superintenda na assistência ao aposentado, ou 
diretamente ao referido estabelecimento, desde que, em qualquer dos casos, a respetiva idoneidade seja atestada pela autoridade 
administrativa com competência para tal.","['Pagamento da Pensão, Impossibilidade de receber a pensão']",['']," DECRETO-LEI N.º 127/87, DE 17 DE MARÇO "
 PAGAMENTO DA PENSÃO, 64,4, , Ana Aido,"4. O conselho poderá mandar examinar o aposentado por médico da Caixa Nacional de Previdência e exigir prova dos requisitos da 
pessoa a designar, podendo também, a todo o tempo, determinar a substituição da que estiver designada.","['Pagamento da Pensão, Exame médico, Situação Clínica']",['']," DECRETO-LEI N.º 127/87, DE 17 DE MARÇO "
 PAGAMENTO DA PENSÃO, 64,5, , Ana Aido,"5. O procedimento referido no n.º 3 e a substituição a que alude o n.º 4 devem ser precedidos de assentimento expresso, dado por
escrito, que só será dispensado quando o estado de saúde mental ou psíquico do aposentado o não permitir.",['Impossibilidade de receber a pensão'],"[' 64.3(from)', ' 64.4(from)']"," DECRETO-LEI N.º 127/87, DE 17 DE MARÇO "
