title,article,alinea,revisto,validado,law_description,topico,referencia,referencia_incm
 MÉDICO RELATOR, 90,2, , Helder Santos,"2. São funções do médico relator, designadamente: a) Verificar se a informação médica recebida está completa e, caso contrário, dar conhecimento 
do facto ao subscritor; b) Realizar o exame clínico ao subscritor; c) Promover a obtenção dos meios auxiliares de diagnóstico, bem como dos exames 
e pareceres especializados que considerar necessários; d) Articular-se diretamente com os serviços e estabelecimentos de saúde ou médicos que 
tenham intervindo na situação clínica do subscritor, objeto de verificação de incapacidade, de forma a obter os elementos necessários ao estudo da 
situação; e) Elaborar um relatório circunstanciado do exame feito com base nos elementos reunidos, organizar o processo clínico do subscritor e 
submetê-lo à junta médica; f) Propor que da junta médica faça parte perito de determinada especialidade, sempre que tal se mostre conveniente.","[' Exame Médico', ' Junta Médica']",[''],
 JUNTA MÉDICA, 91,1, , Helder Santos,"1. A junta médica é composta por três médicos designados pela Caixa, sendo o presidente escolhido entre eles por cooptação.","[' Exame Médico', ' Junta Médica']","['91.2.e).f);n.º 2 do art. 2.º da Portaria n.º 96-B/2008', ' de 30 de janeiro; n.º 2 do art. 35.º da Lei n.º 35/2014', ' de 20 de junho']"," PORTARIA N.º 96-B/2008, DE 30 DE JANEIRO. LEI N.º 35/2014 DE 20 DE JUNHO"
 JUNTA MÉDICA, 91,2, , Helder Santos,"2. Compete à junta médica apreciar o processo clínico do subscritor com base nos dados coligidos pelo médico relator e nos demais 
elementos de diagnóstico constantes do respetivo processo.","[' Exame Médico', ' Situação Clínica']",[''],
 JUNTA MÉDICA, 91,3, , Helder Santos,3. Os pareceres da junta médica são sempre fundamentados.,"[' Exame Médico', ' Informação Clínica']",[''],
 JUNTA MÉDICA, 91,4, , Helder Santos,"4. As orientações técnicas necessárias à atividade do médico relator e ao funcionamento das juntas médicas são asseguradas por 
um conselho médico, cujas composição e competências são estabelecidas por decreto regulamentar.","[' Exame Médico', ' Conselho Médico']","['Decreto Regulamentar n.º 1/2008', ' de 10 de janeiro']"," DECRETO REGULAMENTAR N.º 1/2008, DE 10 DE JANEIRO"
 JUNTA DE RECURSO, 95,1, , Helder Santos,"1. O conselho diretivo da Caixa pode autorizar a realização de juntas de recurso: a) Mediante proposta fundamentada dos serviços 
de que o subscritor dependa, apresentada no prazo de 60 dias; b) Mediante requerimento justificado do subscritor, entregue na
Caixa no prazo de 60 dias a contar da notificação do resultado do exame.","[' Exame Médico', ' Junta de Recurso']","[' n.º 2 do art. 2.º da Portaria n.º 96-B/2008', ' de 30 de janeiro']"," PORTARIA N.º 96-A/2008, DE 30 DE JANEIRO. PORTARIA N.º 96-B/2008, DE 30 DE JANEIRO"
 JUNTA DE RECURSO, 95,2, , Helder Santos,"2. A junta de recurso é composta por dois médicos designados pela Caixa, que não tenham tido anteriormente intervenção no 
processo, e por um médico designado pelo requerente, o qual, não sendo designado no prazo que para o efeito for fixado pelo 
conselho diretivo da Caixa, é substituído por um médico designado pela administração regional de saúde territorialmente 
competente.",[' Exame Médico'],[' '],
 JUNTA DE RECURSO, 95,3, , Helder Santos,3. Compete à junta de recurso apreciar as decisões das juntas médicas relativas à situação dos subscritores.,[' Exame Médico'],[' '],
 JUNTA DE RECURSO, 95,4, , Helder Santos,4. Os pareceres da junta de recurso são sempre fundamentados.,"[' Exame Médico', ' Situação Clínica']",[''],
 JUNTA DE RECURSO, 95,5, , Helder Santos,"5. Pela realização da junta de recurso é devida uma taxa, em montante a definir por portaria do ministro responsável pela área das 
finanças, a pagar pelo requerente, sempre que a decisão lhe seja desfavorável.",[' Exame Médico'],"['art. 1.º da Portaria n.º 96-A/2008', ' de 30 de janeiro']",
 RESOLUÇÃO FINAL, 97,1, , Helder Santos,"1. Concluída a instrução do processo, a administração da Caixa, se julgar verificadas as condições necessárias, proferirá resolução 
final sobre o direito à pensão de aposentação e sobre o montante desta, regulando definitivamente a situação do interessado.","['Direito à Pensão, Processo de Aposentação', ' Resolução']",['34.1'],
 RESOLUÇÃO FINAL, 97,2, , Helder Santos,"2. Suscitando-se dúvidas sobre matéria que possa influir no montante da pensão, a Caixa fixará provisoriamente as bases do seu 
cálculo, em conformidade com os dados já apurados e sem prejuízo da sua retificação em resolução final, uma vez completada a 
instrução do processo.","['Cálculo da Pensão, Processo de Aposentação']",[' '],
 SUSTAÇÃO DA RESOLUÇÃO, 98,1, , Helder Santos,"Não serão proferidas as resoluções a que se refere o artigo precedente enquanto o subscritor estiver preventivamente suspenso ou
afastado do exercício de funções.",['Sustação'],[' 97(from)'],
 TERMO DO SERVIÇO, 99,1, , Helder Santos,1. As resoluções a que se refere o artigo 97.º serão desde logo comunicadas aos serviços onde o subscritor exerça funções.,['Desligado do Serviço'],[' 97(from)'],
 TERMO DO SERVIÇO, 99,2, , Helder Santos,"2. O subscritor considera-se desligado do serviço a partir do dia 1 do mês seguinte àquele em que seja comunicada a resolução da 
Caixa, ficando a aguardar aposentação até ao fim do mês em que seja divulgada a lista dos aposentados com a inclusão do seu 
nome.",['Processo de Aposentação'],[' '],
 TERMO DO SERVIÇO, 99,3, , Helder Santos,"3. Salvo o disposto em lei especial, o subscritor desligado do serviço abre vaga e fica com direito a receber, pela verba destinada ao 
pessoal fora do serviço aguardando aposentação, pensão transitória de aposentação, fixada de harmonia com a comunicação da 
Caixa, a partir do dia em que for desligado do serviço.","['Processo de Aposentação, Direito à Pensão']",[' '],
 DIVULGAÇÃO DA APOSENTAÇÃO, 100,1, , Helder Santos,"1. Concedida a aposentação e fixada a pensão definitiva, inscreve-se o interessado na lista de aposentados a publicar na 2.ª série do 
Diário da República entre os dias 5 e 10 de cada mês, sem prejuízo da sua divulgação na página eletrónica da Caixa, através de 
ligação para o documento publicado.",['Divulgação da Aposentação'],[''],
 DIVULGAÇÃO DA APOSENTAÇÃO, 100,2, , Helder Santos,"2. A mudança de situação resultante do disposto no n.º 3 do artigo 99.º, bem como da aplicação de lei especial naquele referida, é 
divulgada da mesma forma.",['Divulgação da Aposentação'],[' 93.3'],
 DIVULGAÇÃO DA APOSENTAÇÃO, 100,3, , Helder Santos,3. Na publicitação a que se referem os números anteriores indica-se o montante global da pensão.,[' Divulgação da Aposentação'],[''],
 REVISÃO DAS RESOLUÇÕES, 101,1, , Helder Santos,"1. As resoluções finais podem, oficiosamente ou mediante requerimento, ser objeto de revisão quando, por facto não imputável ao 
interessado, tenha havido falta de apresentação, em devido tempo, de elementos de prova relevantes.",['Revisão da Resolução'],[''],
 REVISÃO DAS RESOLUÇÕES, 101,2, , Helder Santos,"2. Os prazos para o interessado requerer a revisão nos casos da alínea a) do número anterior são os referidos no n.º 1 do artigo 
104.º",[''],"[' 101.1(from)', ' 104.1']",
 REVOGAÇÃO E RETIFICAÇÃO DAS RESOLUÇÕES, 102,1, , Helder Santos,"Sem prejuízo do disposto nos artigos 101.º e 103.º, as resoluções finais só podem ser revogadas ou reformadas por ilegalidade, ou
retificadas por erro de escrita ou de cálculo, nos termos gerais de direito.","['Revogação da Resolução, Retificação da Resolução']","[' 101', ' 103; arts. 164.º', ' 165.º e 174.º do Código do Procedimento Administrativo']", CÓDIGO DO PROCEDIMENTO ADMINISTRATIVO
 RECURSOS, 103,1, , Helder Santos,"De quaisquer resoluções definitivas e executórias da administração da Caixa, ou tomadas por delegação sua, haverá recurso 
contencioso, nos termos gerais.",[' Recurso Contencioso'],[' art. 191.º do Código de Processo nos Tribunais Administrativos'], CÓDIGO DE PROCESSO NOS TRIBUNAIS ADMINISTRATIVOS
 COMPETÊNCIA PARA AS RESOLUÇÕES, 108,1, , Helder Santos,"1. Salvo o disposto nos números seguintes, as resoluções da Caixa Geral de Aposentações serão tomadas por 2 administradores.","[' Encarregados pela Resolução', ' Competência']",[''],
 COMPETÊNCIA PARA AS RESOLUÇÕES, 108,2, , Helder Santos,"2. A intervenção do conselho de administração será, todavia, obrigatória nos casos seguintes: a) Se disposição especial o exigir; b) 
Se o próprio conselho o determinar; c) Se os 2 administradores não chegarem a acordo ou qualquer deles entender que o caso 
merece ser submetido ao conselho.","['Encarregados pela Resolução', ' Competência']",[''],
 COMPETÊNCIA PARA AS RESOLUÇÕES, 108,3, , Helder Santos,"3. Podem, porém, os 2 administradores designados para efeitos do n.º 1 delegar os respetivos poderes nos diretores, diretores-
adjuntos ou subdiretores.","[' Encarregados pela Resolução', ' Competência', '']",[' arts. 44.º a 50.º do Código do Procedimento Administrativo'], CÓDIGO DO PROCEDIMENTO ADMINISTRATIVO
 COMPETÊNCIA PARA AS RESOLUÇÕES, 108,4, , Helder Santos,"4. Os atos que estabeleçam as delegações deverão especificar as matérias ou poderes neles abrangidos e serão publicados no 
Diário da República.","[' Encarregados pela Resolução', ' Competência']",['art. 47.º do Código do Procedimento Administrativo'],
 COMPETÊNCIA PARA AS RESOLUÇÕES, 108,5, , Helder Santos,5. A entidade delegada deverá mencionar essa qualidade nos atos que pratique no uso da delegação.,"[' Encarregados pela Resolução', ' Competência']",[' art. 48.º do Código do Procedimento Administrativo'],
 COMPETÊNCIA PARA AS RESOLUÇÕES, 108,6, , Helder Santos,"6. As delegações de competência são revogáveis a todo o tempo, caducam com a substituição do delegante, salvo no caso de 
impedimento temporário, e não prejudicam o direito de avocação.","[' Encarregados pela Resolução', ' Competência', ' Avocação']",[' art. 49.º do Código do Procedimento Administrativo'],
 COMPETÊNCIA PARA AS RESOLUÇÕES, 108,7, , Helder Santos,"7. Os despachos de carácter preparatório podem ser proferidos pelos chefes de serviço, sem prejuízo do direito de avocação pelos
diretores e subdiretores.","[' Encarregados pela Resolução', ' Competência', ' Avocação']",['art. 49.º do Código do Procedimento Administrativo'],
 COMPETÊNCIA PARA AS RESOLUÇÕES, 108,8, , Helder Santos,8. Os despachos de mero expediente podem ser proferidos pelos chefes de secção.,"[' Encarregados pela Resolução', ' Competência']",[''],
 NOTIFICAÇÃO, 109,1, , Bruno Vidal,1. O interessado será notificado das resoluções preparatórias ou definitivas da Caixa.,"['Divulgação da Aposentação', ' Notificação']",[''],
 NOTIFICAÇÃO, 109,2, , Bruno Vidal,"2. As notificações previstas no número anterior e quaisquer comunicações são efetuadas, preferencialmente, através da publicação
dos atos a notificar na área reservada da página eletrónica da Caixa, denominada CGA Direta, acessível através de autenticação 
pelos meios disponíveis.",[''],[' 109.1(from)'],
 NOTIFICAÇÃO, 109,3, , Bruno Vidal,"3. A publicação referida no número anterior é anunciada ao subscritor e ao respetivo serviço, se estiver na efetividade, por correio 
eletrónico e através do serviço de mensagens curtas.",[''],[' 109.2(from)'],
 CONSULTA DO PROCESSO, 110,1, , Bruno Vidal,"Os processos podem ser consultados por advogado com procuração do interessado, durante o prazo para o recurso hierárquico 
necessário ou para o recurso contencioso.","['Processo de Aposentação', ' Recurso Contencioso']",[' arts. 193.º e 198.º do Código do Procedimento Administrativo e art. 191.º do Código de Processo nos Tribunais Administrativos.'], CÓDIGO DO PROCEDIMENTO ADMINISTRATIVO. CÓDIGO DE PROCESSO NOS TRIBUNAIS ADMINISTRATIVOS
 PROCESSOS QUE NÃO SEJAM DE APOSENTAÇÃO, 111,1, , Bruno Vidal,"1. Regem-se igualmente pelas disposições relativas ao processo de aposentação, na parte aplicável, os demais processos cuja 
resolução seja da competência da Caixa Geral de Aposentações.",['Processo de Aposentação'],[''],
 PROCESSOS QUE NÃO SEJAM DE APOSENTAÇÃO, 111,2, , Bruno Vidal,"2. O disposto neste capítulo não é aplicável à impugnação de resoluções tomadas pelas instituições de previdência social para os
fins da alínea b) do n.º 3 do artigo 53.º","['Impugnação', ' Cálculo da Pensão', ' Tempo de Serviço', ' Previdência Social']",[' 53.3 (from)'],
 ÂMBITO E REGIME, 112,1, , Bruno Vidal,"1. Designa-se por reforma a aposentação do pessoal militar do Exército, da Armada, da Força Aérea, da Guarda Fiscal e Guarda 
Nacional Republicana, bem como a do pessoal civil equiparado por lei especial ou militar para efeitos de reforma.","['Serviço Militar, Reforma dos Militares']","[' arts. 120.º', ' 139.º', ' 142.º', ' 161.º e 164.º do Estatuto dos Militares das Forças Armadas e art. 1.º do Decreto-Lei n.º 230/93', ' de 26 de junho\n(extingue a Guarda Fiscal).']"," ESTATUTO DOS MILITARES DAS FORÇAS ARMADAS. DECRETO-LEI N.º 230/93, DE 26 DE JUNHO (EXTINGUE A GUARDA
FISCAL)."
 ÂMBITO E REGIME, 112,2, , Bruno Vidal,2. Considera-se equiparado ao pessoal militar referido no número anterior o pessoal da Polícia de Segurança Pública.,['Polícia de Segurança Pública'],[' 112.1(from)'], ESTATUTO PROFISSIONAL DO PESSOAL COM FUNÇÕES POLICIAIS DA POLÍCIA DE SEGURANÇA PÚBLICA
 ÂMBITO E REGIME, 112,3, , Bruno Vidal,"3. À matéria de reforma é aplicável o regime geral das aposentações em tudo o que não for contrariado por disposição especial do
presente capítulo.",['Reforma dos Militares'],[''],
 INSCRIÇÃO DE MILITARES, 113,1, , Bruno Vidal,"1. Será inscrito na Caixa o pessoal referido no artigo anterior, com exceção do que se encontre a prestar serviço militar obrigatório, 
nos termos da lei do serviço militar, e dos capelães militares eventuais.",['Serviço Militar'],['112.1']," LEI DO SERVIÇO MILITAR APROVADA PELA LEI N.º 174/99, DE 21 DE SETEMBRO, ALTERADA PELA LEI ORGÂNICA N.º 1/2008, 
DE 6 DE MAIO; REGULAMENTO DA LEI DO SERVIÇO MILITAR, APROVADO PELO DECRETO-LEI N.º 289/2000, DE 14 DE NOVEMBRO, ALTERADO 
PELO DECRETO-LEI N.º 52/2009, DE 2 DE MARÇO; REGIME DE CONTRATO ESPECIAL PARA PRESTAÇÃO DE SERVIÇO MILITAR, APROVADO
PELO DECRETO-LEI N.º 130/2010, DE 14 DE DEZEMBRO."
 INSCRIÇÃO DE MILITARES, 113,2, , Bruno Vidal,2. Na reforma dos capelães militares titulares atender-se-á ao disposto em lei especial.,[' Serviço Militar'],"[' art. 15.º do Decreto-Lei n.º 251/2009', ' de 23 de setembro.']"," DECRETO-LEI N.º 251/2009 DE 23 DE SETEMBRO (REGULA O EXERCÍCIO DA 
ASSISTÊNCIA RELIGIOSA NAS FORÇAS ARMADAS E NAS FORÇAS DE SEGURANÇA)"
 SUBSCRITORES NA RESERVA, 114,1, , Bruno Vidal,"Aos subscritores que passem a receber pensão de reserva continua a ser feito em folha o desconto de quotas para a Caixa sobre o 
quantitativo da mesma pensão, salvo o disposto no n.º 2 do artigo 117.º","['Quota, Pensão de Reserva']",['117.2'],
 TEMPO SEM SERVIÇO, 115,1, , Bruno Vidal,"""Contar-se-á para a reforma, mediante a liquidação das quotas respetivas: a) Como tempo de subscritor, aquele em que o militar, 
reintegrado por revisão de processo disciplinar, esteve compulsivamente afastado do serviço; b) Aos oficiais médicos, veterinários e 
farmacêuticos e outros recrutados por exigência legal entre diplomados com curso superior para os quadros permanentes das 
forças armadas, como acréscimo ao tempo de subscritor, o tempo de duração normal dos respetivos cursos de ensino superior, 
desde que completem, para efeitos de reforma, quinze anos de serviço ativo no respetivo quadro.""","['Tempo de Serviço, Serviço Militar, Reforma dos Militares']",[''],
 RESOLUÇÕES SOBRE CONTAGEM DE TEMPO, 116,1, , Bruno Vidal,"As resoluções sobre contagem de tempo acrescido dos subscritores militares, bem como a forma de desconto das respetivas 
quotas, serão comunicadas pela Caixa às competentes autoridades militares.","['Serviço Militar, Quota']",[''],
 TEMPO DE SERVIÇO NA RESERVA, 117,1, , Bruno Vidal,"1. Aos militares que, na situação de reserva, prestem serviço em comissão militar ou civil, com pagamento de quotas à Caixa sobre 
a remuneração auferida, é também contado para a reforma cada ano completo suscetível de influir na melhoria da respetiva 
pensão de reserva.","['Tempo de Serviço, Serviço Militar, Pensão de Reserva, Quota, Reforma dos Militares']",[''],
 TEMPO DE SERVIÇO NA RESERVA, 117,2, , Bruno Vidal,"2. No caso de exercício de cargo previsto no artigo 122.º, a que corresponda remuneração de montante superior ao da pensão de
reserva, a quota devida incidirá apenas sobre essa remuneração.","['Pensão de Reserva, Quota, Remuneração, Pensão de Reserva']",[' 122 '],
 PASSAGEM DA RESERVA À REFORMA, 120,1, , Bruno Vidal,"1. Na reforma de militares que transitem da situação de reserva, e não reúnam as condições legais para a atualização automática 
das respetivas pensões de reserva ou não hajam completado os requisitos fixados na lei para a revisão dessas pensões, a 
remuneração a considerar para os efeitos do artigo 43.º é a que se encontrar estabelecida à data da passagem à reserva, salvo o 
disposto no n.º 3 do presente artigo. Na determinação da pensão de reforma, aquela remuneração será acrescida das últimas 
diuturnidades vigentes para os militares de igual posto, graduação e quadro do ativo, observando-se ainda as normas estabelecidas 
para a generalidade dos subscritores da Caixa.","['Reforma dos Militares, Pensão de Reserva, Remuneração']","[' 43', ' 120.3']",
 PASSAGEM DA RESERVA À REFORMA, 120,2, , Bruno Vidal,"2. Nos restantes casos, as pensões de reforma serão calculadas nos termos que estiverem estipulados para o cálculo de pensões de
reserva e demais legislação aplicável.","['Reforma dos Militares, Pensão de Reserva', ' Pensão de Reforma']",[''],
 PASSAGEM DA RESERVA À REFORMA, 120,3, , Bruno Vidal,"3. O disposto no número anterior não prejudica a opção pela pensão correspondente à remuneração dos cargos mencionados no 
artigo 122.º ou à média decenal prevista no artigo 51.º, desde que se verifiquem as condições exigidas por um ou outro destes
preceitos.","['Reserva', ' Reforma']","[' 120.2(from)', ' 122', ' 51']",
 PASSAGEM DA RESERVA À REFORMA, 120,4, , Bruno Vidal,"4. Os factos anteriores à concessão da pensão de reserva não podem ser considerados para a reforma, se não constarem do 
processo de passagem à reserva, salvo o caso de contagem de tempo de serviço acrescido ao de subscritor.","['Pensão de Reforma, Reforma dos Militares']",[''],
 BASE DO CÁLCULO DA PENSÃO, 121,1, , Bruno Vidal,"1. Sem prejuízo do disposto no artigo 51.º, o cálculo da pensão de reforma tem por base as remunerações de carácter permanente 
referidas nos artigos 47.º e 48.º, que correspondam ao último posto no ativo.",['Cálculo da Pensão'],"['51', ' 47', ' 48']",
 BASE DO CÁLCULO DA PENSÃO, 121,2, , Bruno Vidal,"2. Consideram-se abrangidas nas remunerações a que se refere o n.º 1 as gratificações de serviço de imersão e de serviço de 
mergulhador recebidas pelo pessoal especializado que tenha servido, respetivamente, nas guarnições dos submarinos ou como 
mergulhador da Armada, as quais serão tomadas nos quantitativos correspondentes ao último posto em que esse serviço tenha 
sido prestado, com redução a 80%, arredondada para a centena de escudos imediatamente superior, no caso da gratificação do 
serviço de imersão.",['Cálculo da Pensão'],[' 121.1(from)'],
 BASE DO CÁLCULO DA PENSÃO, 121,3, , Bruno Vidal,"3. Para o pessoal especializado que tenha servido na Marinha, no Exército e na Força Aérea, à pensão calculada nos termos do n.º 1 será 
adicionada uma parcela de montante igual à 36.ª parte do montante da gratificação de serviço aéreo, do suplemento de serviço aéreo, da 
gratificação de serviço paraquedista ou do suplemento de serviço aerotransportado, no quantitativo correspondente ao último posto em que 
esse serviço foi prestado, multiplicado pela expressão em anos do número de meses de serviço, incluindo as percentagens legais de aumento, 
em que foi exercida a atividade inerente ao abono dessa gratificação ou suplemento, considerando-se esse tempo até ao limite de 36 anos e 
a gratificação ou suplemento até ao quantitativo correspondente ao menor valor atribuído a oficial-general na efetividade de serviço.","['Serviço Militar, Cálculo de Pensão']",['121.1'],
 PENSÃO COM BASE EM OUTRO CARGO, 122,1, , Bruno Vidal,"O militar dos quadros permanentes que esteja a exercer continuadamente, nos últimos dois anos, cargo considerado de comissão 
normal pela legislação militar ou, a titulo definitivo, cargo civil poderá optar pela pensão de reforma que corresponda à 
remuneração permanente de qualquer desses cargos, desde que os mesmos confiram direito de aposentação.","['Serviço Militar, Reforma dos Militares, Acumulação de Cargos']",[''],
 REDUÇÃO DA PENSÃO, 124,1, , Bruno Vidal,"A pensão será reduzida de acordo com o disposto no artigo 56.º somente no caso de mudança de situação imposta nos termos da 
alínea d) do n.º 1 do artigo 118.º",['Alteração da Pensão'],"[' 56', ' 118.1']",
 SEPARAÇÃO DE SERVIÇO, 125,1, , Bruno Vidal,Os militares separados do serviço estão sujeitos às restrições estabelecidas pelas leis militares para essa situação.,['Serviço Militar'],[''],
 VIGÊNCIA E APLICAÇÃO DO ESTATUTO, 132,1, , Bruno Vidal,"1. O presente Estatuto entra em vigor em 1 de janeiro de 1973 e é aplicável, sem prejuízo do disposto no artigo 43.º, aos processos 
pendentes.",['Vigência.'],[' 43'],
 VIGÊNCIA E APLICAÇÃO DO ESTATUTO, 132,2, , Bruno Vidal,"2. No caso de alteração de prazos em curso, observar-se-á o disposto na lei civil.","['Vigência', ' Prazos']",[''],
 SUBSISTÊNCIA DE RESOLUÇÕES, 133,1, , Bruno Vidal,"1. Não são prejudicadas pelo disposto neste diploma as resoluções através das quais a Caixa haja reconhecido direitos de inscrição 
ao abrigo do Decreto-Lei n.º 46307, de 27 de abril de 1965, e bem assim as liquidações de quotas, juros, indemnizações e outros 
encargos já descontados em folha pelos serviços competentes ou que tenham sido objeto de resolução da mesma Caixa embora 
não esteja ainda iniciado o respetivo pagamento.","['Validade das Resoluções', ' Quota', ' Inscrição']","[' Decreto-Lei n.º 46307', ' de 27 de abril de 1965']",
 SUBSISTÊNCIA DE RESOLUÇÕES, 133,2, , Bruno Vidal,"2. Subsiste igualmente inscrição dos subscritores exonerados dos seus cargos, que se haja mantido por virtude do disposto no 
artigo 187.º do Decreto-Lei n.º 35108, de 7 de novembro do 1945.","['validade das Resoluções', ' Inscrição']","[' artigo 187.º do Decreto-Lei n.º 35108', ' de 7 de novembro do 1945']",
 SUBSISTÊNCIA DA QUOTA ANTERIOR, 134,1, , Bruno Vidal,"A quota dos subscritores inscritos anteriormente a 1 de outubro de 1954 mantém-se em 5 por cento, se a sua remuneração base 
não excede 1200$00 por mês.",[' Validade da quota anterior'],[''],
 QUOTA ANTERIOR DE MILITARES NA RESERVA, 135,1, , Bruno Vidal,"Os militares na situação de reserva continuam sujeitos ao desconto, quando devido, da quota de 4 por cento, relativamente ao 
tempo de serviço anterior à data da elevação dessa taxa, se a respetiva pensão tiver sido definitivamente fixada antes da mesma 
data.","['Serviço Militar', ' Quota']",[''],
 ACRÉSCIMO À PENSÃO DE REFORMA, 136,1, , Bruno Vidal,"1. A pensão de reforma é acrescida de 0,14 por cento relativamente a cada período de trinta dias de serviço prestado em 
campanha ou no ultramar, até à data em que foi imposta a obrigação legal de desconto de quotas para a Caixa.",['Reforma dos Militares'],[''],
 ACRÉSCIMO À PENSÃO DE REFORMA, 136,2, , Bruno Vidal,"2. O acréscimo não excederá, todavia, 25% da remuneração considerada para o cálculo da pensão e o total desta não poderá 
ultrapassar o montante da que caberia ao subscritor com base em 36 anos de serviço.","[' Cálculo da Pensão, Reforma dos Militares']",[''],
 ABONO DOS APOSENTADOS EM SERVIÇO, 137,1, ,,"O disposto no artigo 79.º não prejudica o regime de abonos dos aposentados que à data da entrada em vigor do presente diploma
já se encontram em exercício de funções.",[' Abonos'],[' 79'],
 CONTRIBUIÇÃO DO ESTADO PARA A CAIXA, 139,1, , Bruno Vidal,"O Estado contribuirá anualmente para a Caixa Geral de Aposentações com a quantia necessária para assegurar o equilíbrio 
financeiro da instituição, inscrevendo a verba respetiva no orçamento de despesa do Ministério das Finanças.",[' Contribuição do Estado'],[''],
 DÍVIDAS DOS CORPOS ADMINISTRATIVOS, 140,1, , Bruno Vidal,"As dívidas dos corpos administrativos à Caixa Geral de Aposentações quando não sejam satisfeitas voluntariamente, serão 
cobradas, a requisição da mesma Caixa, através da Direcção-Geral da Fazenda Pública, por meio de desconto nas percentagens 
adicionais às e impostos do Estado.",['Dívida'],[''],
